{
  "id": "example_semantic",
  "type": "semantic",
  "created": "2024-01-15T09:00:00",
  "source": "manual",
  "concept": "Memory Layering",
  "description": "Raw inputs must always be preserved verbatim so they can be re-analyzed with better tools in the future. Derived layers (episodic, semantic, reflections) are built on top without ever modifying or deleting the source material.",
  "importance": 0.75,
  "tags": ["concept", "pattern", "learning"],
  "links": ["[[episodic/example_episodic]]", "[[raw/example_raw]]"]
}
